{
  "schemaVersion": "1.0.0",
  "id": "original-sprunki",
  "title": "Original Sprunki",
  "characters": [
    {
      "id": "orange-oren",
      "name": "Oren",
      "color": "#ff7a00",
      "phases": [
        {
          "id": "phase1",
          "title": "Phase 1",
          "portrait": "./extensions/learn-sprunki/content/games/original-sprunki/characters/orange-oren/phase1.svg",
          "locked": false,
          "lessonTrackId": "orange-oren-phase1-draft",
          "instrumentId": "percussion",
          "effectId": "impact-sparks",
          "category": "percussion",
          "playerMode": "rhythm",
          "rhythmLabel": "Kick"
        },
        {
          "id": "phase2",
          "title": "Phase 2",
          "portrait": "./extensions/learn-sprunki/content/games/original-sprunki/characters/orange-oren/phase2.svg",
          "locked": false,
          "lessonTrackId": "orange-oren-phase2-draft",
          "instrumentId": "percussion",
          "effectId": "impact-sparks",
          "category": "percussion",
          "playerMode": "rhythm",
          "rhythmLabel": "Kick"
        }
      ]
    },
    {
      "id": "red-raddy",
      "name": "Raddy",
      "color": "#ed3434",
      "phases": [
        {
          "id": "phase1",
          "title": "Phase 1",
          "portrait": "./extensions/learn-sprunki/content/games/original-sprunki/characters/red-raddy/phase1.svg",
          "locked": false,
          "lessonTrackId": "red-raddy-phase1-draft",
          "instrumentId": "percussion",
          "effectId": "impact-sparks",
          "category": "percussion",
          "playerMode": "rhythm",
          "rhythmLabel": "Snare"
        },
        {
          "id": "phase2",
          "title": "Phase 2",
          "portrait": "./extensions/learn-sprunki/content/games/original-sprunki/characters/red-raddy/phase2.svg",
          "locked": false,
          "lessonTrackId": "red-raddy-phase2-draft",
          "instrumentId": "percussion",
          "effectId": "impact-sparks",
          "category": "percussion",
          "playerMode": "rhythm",
          "rhythmLabel": "Snare"
        }
      ]
    },
    {
      "id": "silver-clukr",
      "name": "Clukr",
      "color": "#b7c1cc",
      "phases": [
        {
          "id": "phase1",
          "title": "Phase 1",
          "portrait": "./extensions/learn-sprunki/content/games/original-sprunki/characters/silver-clukr/phase1.svg",
          "locked": false,
          "lessonTrackId": "silver-clukr-phase1-draft",
          "instrumentId": "percussion",
          "effectId": "bright-sparks",
          "category": "percussion",
          "playerMode": "rhythm",
          "rhythmLabel": "Ride"
        },
        {
          "id": "phase2",
          "title": "Phase 2",
          "portrait": "./extensions/learn-sprunki/content/games/original-sprunki/characters/silver-clukr/phase2.svg",
          "locked": false,
          "lessonTrackId": "silver-clukr-phase2-draft",
          "instrumentId": "percussion",
          "effectId": "bright-sparks",
          "category": "percussion",
          "playerMode": "rhythm",
          "rhythmLabel": "Knock"
        }
      ]
    },
    {
      "id": "fun-bot",
      "name": "Fun Bot",
      "color": "#8d99a8",
      "phases": [
        {
          "id": "phase1",
          "title": "Phase 1",
          "portrait": "./extensions/learn-sprunki/content/games/original-sprunki/characters/fun-bot/phase1.svg",
          "locked": false,
          "lessonTrackId": "fun-bot-phase1-draft",
          "instrumentId": "percussion",
          "effectId": "bright-sparks",
          "category": "percussion",
          "playerMode": "rhythm",
          "rhythmLabel": "Breakbeat"
        },
        {
          "id": "phase2",
          "title": "Phase 2",
          "portrait": "./extensions/learn-sprunki/content/games/original-sprunki/characters/fun-bot/phase2.svg",
          "locked": false,
          "lessonTrackId": "fun-bot-phase2-draft",
          "instrumentId": "percussion",
          "effectId": "bright-sparks",
          "category": "percussion",
          "playerMode": "rhythm",
          "rhythmLabel": "Breakbeat"
        }
      ]
    },
    {
      "id": "green-vineria",
      "name": "Vineria",
      "color": "#35b86b",
      "phases": [
        {
          "id": "phase1",
          "title": "Phase 1",
          "portrait": "./extensions/learn-sprunki/content/games/original-sprunki/characters/green-vineria/phase1.svg",
          "locked": false,
          "lessonTrackId": "green-vineria-phase1-draft",
          "instrumentId": "percussion",
          "effectId": "bright-sparks",
          "category": "percussion",
          "playerMode": "rhythm",
          "rhythmLabel": "Shaker"
        },
        {
          "id": "phase2",
          "title": "Phase 2",
          "portrait": "./extensions/learn-sprunki/content/games/original-sprunki/characters/green-vineria/phase2.svg",
          "locked": false,
          "lessonTrackId": "green-vineria-phase2-draft",
          "instrumentId": "percussion",
          "effectId": "bright-sparks",
          "category": "percussion",
          "playerMode": "rhythm",
          "rhythmLabel": "Shaker"
        }
      ]
    },
    {
      "id": "gray-gray",
      "name": "Gray",
      "color": "#777b82",
      "phases": [
        {
          "id": "phase1",
          "title": "Phase 1",
          "portrait": "./extensions/learn-sprunki/content/games/original-sprunki/characters/gray-gray/phase1.svg",
          "locked": false,
          "lessonTrackId": "gray-gray-phase1-draft",
          "instrumentId": "synth-bass",
          "effectId": "shadow-sparks",
          "category": "pitched-monophonic",
          "playerMode": "piano"
        },
        {
          "id": "phase2",
          "title": "Phase 2",
          "portrait": "./extensions/learn-sprunki/content/games/original-sprunki/characters/gray-gray/phase2.svg",
          "locked": false,
          "lessonTrackId": "gray-gray-phase2-draft",
          "instrumentId": "synth-bass",
          "effectId": "shadow-sparks",
          "category": "pitched-monophonic",
          "playerMode": "piano"
        }
      ]
    },
    {
      "id": "brown-brud",
      "name": "Brud",
      "color": "#9b633f",
      "phases": [
        {
          "id": "phase1",
          "title": "Phase 1",
          "portrait": "./extensions/learn-sprunki/content/games/original-sprunki/characters/brown-brud/phase1.svg",
          "locked": true,
          "lessonTrackId": null,
          "instrumentId": "sound-effect",
          "effectId": "impact-sparks",
          "category": "effect",
          "playerMode": null
        },
        {
          "id": "phase2",
          "title": "Phase 2",
          "portrait": "./extensions/learn-sprunki/content/games/original-sprunki/characters/brown-brud/phase2.svg",
          "locked": true,
          "lessonTrackId": null,
          "instrumentId": "sound-effect",
          "effectId": "impact-sparks",
          "category": "effect",
          "playerMode": null
        }
      ]
    },
    {
      "id": "gold-garnold",
      "name": "Garnold",
      "color": "#e7b928",
      "phases": [
        {
          "id": "phase1",
          "title": "Phase 1",
          "portrait": "./extensions/learn-sprunki/content/games/original-sprunki/characters/gold-garnold/phase1.svg",
          "locked": false,
          "lessonTrackId": "gold-garnold-phase1-draft",
          "instrumentId": "synth-lead",
          "effectId": "sun-sparks",
          "category": "pitched-polyphonic",
          "playerMode": "piano"
        },
        {
          "id": "phase2",
          "title": "Phase 2",
          "portrait": "./extensions/learn-sprunki/content/games/original-sprunki/characters/gold-garnold/phase2.svg",
          "locked": false,
          "lessonTrackId": "gold-garnold-phase2-draft",
          "instrumentId": "synth-lead",
          "effectId": "sun-sparks",
          "category": "pitched-polyphonic",
          "playerMode": "piano"
        }
      ]
    },
    {
      "id": "lime-owakcx",
      "name": "OWAKCX",
      "color": "#a7e62e",
      "phases": [
        {
          "id": "phase1",
          "title": "Phase 1",
          "portrait": "./extensions/learn-sprunki/content/games/original-sprunki/characters/lime-owakcx/phase1.svg",
          "locked": true,
          "lessonTrackId": null,
          "instrumentId": "sound-effect",
          "effectId": "bright-sparks",
          "category": "effect",
          "playerMode": null
        },
        {
          "id": "phase2",
          "title": "Phase 2",
          "portrait": "./extensions/learn-sprunki/content/games/original-sprunki/characters/lime-owakcx/phase2.svg",
          "locked": true,
          "lessonTrackId": null,
          "instrumentId": "sound-effect",
          "effectId": "bright-sparks",
          "category": "effect",
          "playerMode": null
        }
      ]
    },
    {
      "id": "sky-blue-sky",
      "name": "Sky",
      "color": "#7edcf5",
      "phases": [
        {
          "id": "phase1",
          "title": "Phase 1",
          "portrait": "./extensions/learn-sprunki/content/games/original-sprunki/characters/sky-blue-sky/phase1.svg",
          "locked": false,
          "lessonTrackId": "sky-blue-sky-phase1-draft",
          "instrumentId": "music-box",
          "effectId": "bright-sparks",
          "category": "pitched-polyphonic",
          "playerMode": "piano"
        },
        {
          "id": "phase2",
          "title": "Phase 2",
          "portrait": "./extensions/learn-sprunki/content/games/original-sprunki/characters/sky-blue-sky/phase2.svg",
          "locked": false,
          "lessonTrackId": "sky-blue-sky-phase2-draft",
          "instrumentId": "music-box",
          "effectId": "bright-sparks",
          "category": "pitched-polyphonic",
          "playerMode": "piano"
        }
      ]
    },
    {